Arthas;55juse55;Кодекс гулей;"зачем ты что-то пишешь, зачем ты что-то дышишь"
roflan;Rofl123;Кодекс гулей;"так ты сам позер, а не гуль"
CHINANUMBERONE;MaoTseTung;Кодекс гулей;минус 1000 social credit
skynet;papich123;Проклятые лутбоксы!;поддерживаю скажем нет продажрности разрабов
Arthas;55juse55;Проклятые лутбоксы!;"да им, как и мне только на еду хватает. Не осуждайте если не знаете"
skynet;papich123;Кодекс гулей;"Дружочек, ты видимо не понял с кем общаешься. Вот эта твоя манера речи ""клоунская"" меня не впечатляет, давай встретимся, объясню на понятном тебе языке, языке боли."